{
  "$schema": "https://json-schema.org/draft/2020-12/schema",
  "$id": "https://github.com/angusbezzina/whetstone/references/principle-pack-v1.schema.json",
  "title": "Whetstone principle pack",
  "description": "A named, versioned list of principles a repository's owner can pick from. pstack ships as the default pack and a pack distilled from Matt Pocock's skills ships beside it; a repository adds its own under whetstone/principles/*.json. A principle id is unique across every loaded pack.",
  "type": "object",
  "additionalProperties": false,
  "required": ["schema", "name", "version", "source", "license", "principles"],
  "properties": {
    "schema": { "const": "whetstone.principle-pack.v1" },
    "name": { "type": "string", "pattern": "^[a-z0-9-]{1,64}$" },
    "version": { "type": "string", "minLength": 1 },
    "source": { "type": "string", "description": "Where the principles come from: a repository, a team or a book." },
    "license": { "type": "string" },
    "commit": { "type": "string", "description": "The source revision the text was read from, when it has one." },
    "principles": {
      "type": "array",
      "minItems": 1,
      "items": {
        "type": "object",
        "additionalProperties": false,
        "required": ["id", "group", "text", "enforcer_hint"],
        "properties": {
          "id": { "type": "string", "pattern": "^[a-z0-9-]{1,64}$", "not": { "const": "starting" } },
          "group": { "type": "string" },
          "text": { "type": "string", "minLength": 1 },
          "enforcer_hint": {
            "description": "The enforcer kind that usually holds the principle, or none when it is held by review.",
            "enum": ["ast", "lint", "formatter", "test", "validator", "none"]
          },
          "rationale": { "type": ["string", "null"] },
          "starting": { "type": "boolean", "description": "Offered as a starting point: onboarding ticks it until the owner holds a principle, and --principle starting picks it. The id starting is reserved." }
        }
      }
    }
  }
}
