{
  "schema": "whetstone.principle-pack.v1",
  "name": "pstack",
  "version": "0.15.5",
  "source": "cursor/plugins pstack",
  "commit": "12d587dfb20741cafc376c42c696c5f6e2a64487",
  "license": "Principle text from pstack by Lauren Tan, MIT License. The enforcer hints are Whetstone's judgement, not pstack's.",
  "principles": [
    {
      "id": "laziness-protocol",
      "group": "core",
      "text": "Bias toward deletion and the smallest change that solves the problem.",
      "enforcer_hint": "none",
      "rationale": null,
      "starting": true
    },
    {
      "id": "foundational-thinking",
      "group": "core",
      "text": "Apply before writing logic: choosing core types and data structures, sequencing scaffold-vs-feature work, asking what concurrent actors share. Get the data structures right so downstream code becomes obvious.",
      "enforcer_hint": "none",
      "rationale": null
    },
    {
      "id": "redesign-from-first-principles",
      "group": "core",
      "text": "Redesign as if the requirement had been a foundational assumption from day one, instead of bolting it on.",
      "enforcer_hint": "none",
      "rationale": null
    },
    {
      "id": "attack-the-premise",
      "group": "core",
      "text": "Apply when two or more fixes that share one premise have failed the same gate. Take a census of which actors hold the imbalance before the next fix, then question the premise instead of writing another fix that assumes it.",
      "enforcer_hint": "none",
      "rationale": null
    },
    {
      "id": "subtract-before-you-add",
      "group": "core",
      "text": "Remove dead weight, redundant validators, and stub references first, then build on the simpler base.",
      "enforcer_hint": "none",
      "rationale": null
    },
    {
      "id": "minimize-reader-load",
      "group": "core",
      "text": "Count layers between question and answer, and hidden state in the reader's head; collapse one-caller wrappers and shrink mutable scope.",
      "enforcer_hint": "none",
      "rationale": null
    },
    {
      "id": "outcome-oriented-execution",
      "group": "core",
      "text": "Apply during planned rewrites and migrations with explicit phase boundaries. Converge on the target architecture; don't preserve smooth intermediate states with throwaway compatibility code.",
      "enforcer_hint": "none",
      "rationale": null
    },
    {
      "id": "experience-first",
      "group": "core",
      "text": "Choose user delight over implementation convenience; ship fewer polished features over more rough ones.",
      "enforcer_hint": "none",
      "rationale": null
    },
    {
      "id": "exhaust-the-design-space",
      "group": "core",
      "text": "Build 2-3 competing prototypes and compare side by side before committing.",
      "enforcer_hint": "none",
      "rationale": null
    },
    {
      "id": "build-the-lever",
      "group": "core",
      "text": "Apply to any non-trivial work, not just bulk work: edits, migrations, analyses, checks. Build the tool that does it or proves it (codemod, script, generator, or a skill your subagents follow) instead of working by hand. The tool is the artifact a reviewer can rerun.",
      "enforcer_hint": "none",
      "rationale": null
    },
    {
      "id": "model-the-domain",
      "group": "architecture",
      "text": "Encode the domain in a structure instead of scattered conditionals.",
      "enforcer_hint": "none",
      "rationale": null
    },
    {
      "id": "boundary-discipline",
      "group": "architecture",
      "text": "Concentrate guards at system boundaries (CLI, config, network, external APIs); trust internal types and keep business logic in pure functions.",
      "enforcer_hint": "none",
      "rationale": null,
      "starting": true
    },
    {
      "id": "type-system-discipline",
      "group": "architecture",
      "text": "Make illegal states unrepresentable, brand semantic primitives, parse external data at boundaries, refuse to lie to the compiler, exhaust variants, derive from authoritative schemas.",
      "enforcer_hint": "lint",
      "rationale": null
    },
    {
      "id": "make-operations-idempotent",
      "group": "architecture",
      "text": "Converge to the same end state regardless of partial prior runs.",
      "enforcer_hint": "test",
      "rationale": null
    },
    {
      "id": "migrate-callers-then-delete-legacy-apis",
      "group": "architecture",
      "text": "Migrate callers and delete the old API in the same wave instead of preserving compatibility layers.",
      "enforcer_hint": "none",
      "rationale": null
    },
    {
      "id": "separate-before-serializing-shared-state",
      "group": "architecture",
      "text": "Eliminate the sharing first; serialize structurally only when one shared writer is a real invariant.",
      "enforcer_hint": "none",
      "rationale": null
    },
    {
      "id": "prove-it-works",
      "group": "verification",
      "text": "Apply after completing a task, before declaring done. Verify against the real artifact (run the feature, read the actual value, inspect the diff), not a proxy, self-report, or 'it compiles.'.",
      "enforcer_hint": "test",
      "rationale": null,
      "starting": true
    },
    {
      "id": "fix-root-causes",
      "group": "verification",
      "text": "Trace each symptom to its root cause and fix it there; reproduce first, ask why until you reach it, resist nil-check guards that silence crashes.",
      "enforcer_hint": "none",
      "rationale": null,
      "starting": true
    },
    {
      "id": "sequence-verifiable-units",
      "group": "verification",
      "text": "Apply to multi-step work (sweeps, migrations, runs of similar edits) and to how you stack commits and PRs. Break work into small units that each end in a verifiable state, check each before the next, and order delivery so the sequence proves itself to a reviewer.",
      "enforcer_hint": "test",
      "rationale": null
    },
    {
      "id": "test-behavior-not-implementation",
      "group": "verification",
      "text": "Apply when you write, change, or keep a test. Call the code the way its users do and assert the result they observe against a literal expected value. If the test would still pass when every imported function returns undefined, rewrite the assertion or delete the test.",
      "enforcer_hint": "none",
      "rationale": null,
      "starting": true
    },
    {
      "id": "guard-the-context-window",
      "group": "delegation",
      "text": "Route bulk to subagents; keep summaries in the main thread, not raw payloads.",
      "enforcer_hint": "none",
      "rationale": null
    },
    {
      "id": "never-block-on-the-human",
      "group": "delegation",
      "text": "Proceed, present the result, let the human course-correct after the fact; reserve confirmation for irreversible actions.",
      "enforcer_hint": "none",
      "rationale": null
    },
    {
      "id": "encode-lessons-in-structure",
      "group": "meta",
      "text": "Encode the rule as a lint, metadata flag, runtime check, or script instead of more text.",
      "enforcer_hint": "none",
      "rationale": null,
      "starting": true
    }
  ]
}
